title;keywords;annotation;class
Cost Aggregation and Occlusion Handling With WLS in Stereo Matching;"computational complexity; computer graphics; costing; image matching; image resolution; interpolation; iterative methods; least squares approximations; stereo image processing; gauss-seidel method; adaptive interpolation; cost aggregation; energy function; iterative equation; occlusion handling; optimal cost estimation; per-pixel difference image; stereo matching; weighted least squares; cost aggregation; multiscale approach; occlusion handling; stereo vision; weighted least square; algorithms; artificial intelligence; image enhancement; image interpretation, computer-assisted; imaging, three-dimensional; information storage and retrieval; least-squares analysis; models, statistical; pattern recognition, automated; photogrammetry; reproducibility of results; sensitivity and specificity;""";This paper presents a novel method for cost aggregation and occlusion handling for stereo matching. In order to estimate optimal cost, given a per-pixel difference image as observed data, we define an energy function and solve the minimization problem by solving the iterative equation with the numerical method. We improve performance and increase the convergence rate by using several acceleration techniques such as the Gauss-Seidel method, the multiscale approach, and adaptive interpolation. The proposed method is computationally efficient since it does not use color segmentation or any global optimization techniques. For occlusion handling, which has not been performed effectively by any conventional cost aggregation approaches, we combine the occlusion problem with the proposed minimization scheme. Asymmetric information is used so that few additional computational loads are necessary. Experimental results show that performance is comparable to that of many state-of-the-art methods. The proposed method is in fact the most successful among all cost aggregation methods based on standard stereo test beds.;3
Minimization of Region-Scalable Fitting Energy for Image Segmentation;"approximation theory; curve fitting; edge detection; image motion analysis; image segmentation; minimisation; set theory; contour motion; curve evolution equation; data fitting energy; image intensity approximation; image segmentation; kernel function; level set regularization; real-world image intensity inhomogeneity; region-based active contour model; region-scalable fitting energy minimization; variational level set formulation; active contours; active shape model; data mining; equations; image edge detection; image segmentation; kernel; level set; mathematics; robustness; image segmentation; intensity inhomogeneity; level set method; region-scalable fitting energy; variational method; algorithms; artificial intelligence; image enhancement; image interpretation, computer-assisted; pattern recognition, automated; reproducibility of results; sensitivity and specificity;""";Intensity inhomogeneities often occur in real-world images and may cause considerable difficulties in image segmentation. In order to overcome the difficulties caused by intensity inhomogeneities, we propose a region-based active contour model that draws upon intensity information in local regions at a controllable scale. A data fitting energy is defined in terms of a contour and two fitting functions that locally approximate the image intensities on the two sides of the contour. This energy is then incorporated into a variational level set formulation with a level set regularization term, from which a curve evolution equation is derived for energy minimization. Due to a kernel function in the data fitting term, intensity information in local regions is extracted to guide the motion of the contour, which thereby enables our model to cope with intensity inhomogeneity. In addition, the regularity of the level set function is intrinsically preserved by the level set regularization term to ensure accurate computation and avoids expensive reinitialization of the evolving level set function. Experimental results for synthetic and real images show desirable performances of our method.;3
Multistage Branch-and-Bound Merging for Planar Surface Segmentation in Disparity Space;"image segmentation; iterative methods; stereo image processing; disparity image; disparity space; iterative split-and-merge framework; maximum variance constraint; multistage branch-and-bound merging; multistage merging estimation; planar surface segmentation; stereo image data; combinatorial optimization; image segmentation; object detection; stereo vision; algorithms; artificial intelligence; image enhancement; image interpretation, computer-assisted; imaging, three-dimensional; pattern recognition, automated; reproducibility of results; sensitivity and specificity;""";An iterative split-and-merge framework for the segmentation of planar surfaces in the disparity space is presented. Disparity of a scene is modeled by approximating various surfaces in the scene to be planar. In the split phase, the number of planar surfaces along with the underlying plane parameters is assumed to be known from the initialization or from the previous merge phase. Based on these parameters, planar surfaces in the disparity image are labeled to minimize the residuals between the actual disparity and the modeled disparity. The labeled planar surfaces are separated into spatially continuous regions which are treated as candidates for the merging that follows. The regions are merged together under a maximum variance constraint while maximizing the merged area. A multistage branch-and-bound algorithm is proposed to carry out this optimization efficiently. Each stage of the branch-and-bound algorithm separates a planar surface from the set of spatially continuous regions. The multistage merging estimates the number of planar surfaces and their labeling. The splitting and the multistage merging is repeated till convergence is reached or satisfactory results are achieved. Experimental results are presented for variety of stereo image data.;3
"A Multiresolution Stochastic Level Set Method for Mumford&#x2013;Shah Image Segmentation";"image resolution; image segmentation; simulated annealing; stochastic programming; mumford-shah image segmentation; basin hopping; multiresolution stochastic level set; region splitting; simulated annealing; stochastic methods; stochastic optimization; computational efficiency; computational modeling; heart; image resolution; image segmentation; level set; optimization methods; simulated annealing; spatial resolution; stochastic processes; basin hopping; mumford&amp;#x2013;shah model; global optimization; image segmentation; region splitting and merging; stochastic level set method; algorithms; artificial intelligence; computer simulation; image enhancement; image interpretation, computer-assisted; models, statistical; pattern recognition, automated; reproducibility of results; sensitivity and specificity; stochastic processes;""";The Mumford-Shah model is one of the most successful image segmentation models. However, existing algorithms for the model are often very sensitive to the choice of the initial guess. To make use of the model effectively, it is essential to develop an algorithm which can compute a global or near global optimal solution efficiently. While gradient descent based methods are well-known to find a local minimum only, even many stochastic methods do not provide a practical solution to this problem either. In this paper, we consider the computation of a global minimum of the multiphase piecewise constant Mumford-Shah model. We propose a hybrid approach which combines gradient based and stochastic optimization methods to resolve the problem of sensitivity to the initial guess. At the heart of our algorithm is a well-designed basin hopping scheme which uses global updates to escape from local traps in a way that is much more effective than standard stochastic methods. In our experiments, a very high-quality solution is obtained within a few stochastic hops whereas the solutions obtained with simulated annealing are incomparable even after thousands of steps. We also propose a multiresolution approach to reduce the computational cost and enhance the search for a global minimum. Furthermore, we derived a simple but useful theoretical result relating solutions at different spatial resolutions.;3
A Region Merging Prior for Variational Level Set Image Segmentation;"curve fitting; image segmentation; active contours; curve evolution; image segmentation; level sets; region merging; councils; equations; image segmentation; level set; merging; motion estimation; testing; tracking; active contours; image segmentation; level sets; segmentation prior; algorithms; artificial intelligence; image enhancement; image interpretation, computer-assisted; imaging, three-dimensional; pattern recognition, automated; reproducibility of results; sensitivity and specificity; subtraction technique;""";In current level set image segmentation methods, the number of regions is assumed to known beforehand. As a result, it remains constant during the optimization of the objective functional. How to allow it to vary is an important question which has been generally avoided. This study investigates a region merging prior related to regions area to allow the number of regions to vary automatically during curve evolution, thereby optimizing the objective functional implicitly with respect to the number of regions. We give a statistical interpretation to the coefficient of this prior to balance its effect systematically against the other functional terms. We demonstrate the validity and efficiency of the method by testing on real images of intensity, color, and motion.;3
The solutions of equation-based noise detector for an adaptive median filter;"noise detection; equation; impulse noise; median filter;";"Techniques of noise detection have been widely applied in impulse noise reduction. However, the phenomenon of pixel misclassification is very obvious in high noise density. In order to improve pixel identification, in this paper, the new noise detector is proposed. Based on solutions of equations, an estimated block of every 8&times;88&times;8 block of a noise image is generated. Then, according to relationships between these noise blocks and their estimated blocks, corrupted and uncorrupted pixels are identified. During image filtering, a noise-detection-based adaptive median algorithm is presented. Experimental results show that the proposed filter can well reduce the impulse noise and preserve more details of original images.";4
Improved Bayesian image denoising based on wavelets with applications to electron microscopy;"image denoising; bayesian filtering; wavelets;";"In this work we discuss an improvement of the image-denoising wavelet-based method presented by Bijaoui [Wavelets, Gaussian mixtures and Wiener filtering, Signal Process. 82 (2002) 709&ndash;712]. We show that the parameter estimation step can be replaced by a constrained nonlinear optimization. We propose three different methods to estimate the parameters. As in Bijaouis original article, two of them deal with white noise. We show that the resulting algorithms improve the one originally proposed. Our third method extends the applicability of the denoising algorithm to colored noise. We test our algorithms with images simulating electron microscopy (EM) conditions as well as experimental EM images.";4
Adaptive Bilateral Filter for Sharpness Enhancement and Noise Removal;"adaptive filters; edge detection; image denoising; image enhancement; image restoration; image texture; statistical analysis; adaptive bilateral filter; edge detection; edge profile extraction; histogram; image noise removal; image sharpness enhancement; image texture; slope image restoration; unsharp mask; bilateral filter; de-blurring; noise removal; range filter; sharpness enhancement; slope restoration; algorithms; artifacts; artificial intelligence; computer graphics; image enhancement; image interpretation, computer-assisted; information storage and retrieval; numerical analysis, computer-assisted; pattern recognition, automated; reproducibility of results; sensitivity and specificity; signal processing, computer-assisted;""";In this paper, we present the adaptive bilateral filter (ABF) for sharpness enhancement and noise removal. The ABF sharpens an image by increasing the slope of the edges without producing overshoot or undershoot. It is an approach to sharpness enhancement that is fundamentally different from the unsharp mask (USM). This new approach to slope restoration also differs significantly from previous slope restoration algorithms in that the ABF does not involve detection of edges or their orientation, or extraction of edge profiles. In the ABF, the edge slope is enhanced by transforming the histogram via a range filter with adaptive offset and width. The ABF is able to smooth the noise, while enhancing edges and textures in the image. The parameters of the ABF are optimized with a training procedure. ABF restored images are significantly sharper than those restored by the bilateral filter. Compared with an USM based sharpening method-the optimal unsharp mask (OUM), ABF restored edges are as sharp as those rendered by the OUM, but without the halo artifacts that appear in the OUM restored image. In terms of noise removal, ABF also outperforms the bilateral filter and the OUM. We demonstrate that ABF works well for both natural images and text images.;4
Algorithmic and Architectural Optimizations for Computationally Efficient Particle Filtering;"convex programming; image sequences; optical tracking; particle filtering (numerical methods); pipeline processing; sampling methods; video signal processing; convex program; independent metropolis hastings sampler; nongaussian noise process; nonlinear dynamical system filtering; particle filtering algorithm; pipelined architectural optimization; video sequences; visual tracking; auxillary variable; monte carlo markov chain (mcmc); design methodologies; particle filter; resampling; visual tracking; algorithms; artificial intelligence; computer simulation; data compression; image enhancement; image interpretation, computer-assisted; models, statistical; pattern recognition, automated; reproducibility of results; sensitivity and specificity; signal processing, computer-assisted; video recording;""";In this paper, we analyze the computational challenges in implementing particle filtering, especially to video sequences. Particle filtering is a technique used for filtering nonlinear dynamical systems driven by non-Gaussian noise processes. It has found widespread applications in detection, navigation, and tracking problems. Although, in general, particle filtering methods yield improved results, it is difficult to achieve real time performance. In this paper, we analyze the computational drawbacks of traditional particle filtering algorithms, and present a method for implementing the particle filter using the Independent Metropolis Hastings sampler, that is highly amenable to pipelined implementations and parallelization. We analyze the implementations of the proposed algorithm, and, in particular, concentrate on implementations that have minimum processing times. It is shown that the design parameters for the fastest implementation can be chosen by solving a set of convex programs. The proposed computational methodology was verified using a cluster of PCs for the application of visual tracking. We demonstrate a linear speedup of the algorithm using the methodology proposed in the paper.;4
An Orientation-Selective Orthogonal Lapped Transform;"hartley transforms; data compression; filtering theory; image coding; image denoising; image texture; iterative methods; statistical analysis; 2d block hartley transform; biorthogonal transform; cosine wave; image compression; iterative filter; lapped hartley transform; modulating basis functions; noise removal; orientation-selective orthogonal lapped transform; oriented textures; overlapping basis functions; statistical analysis; synthesis operation; lapped transform; local orientation; transform coding; algorithms; image enhancement; image interpretation, computer-assisted; reproducibility of results; sensitivity and specificity;""";A novel critically sampled orientation-selective orthogonal lapped transform called the lapped Hartley transform (LHT) is derived. In a first step, overlapping basis functions are generated by modulating basis functions of a 2-D block Hartley transform by a cosine wave. To achieve invertibility and orthogonality, an iterative filter is applied as prefilter in the analysis and as postfilter in the synthesis operation, respectively. Alternatively, filtering can be restricted to analysis or synthesis, ending up with a biorthogonal transform (LHT-PR, LHT-PO). A statistical analysis based on a 4000-image data base shows that the LHT and LHT-PO have better redundancy removal properties than other block or lapped transforms. Finally, image compression and noise removal examples are given, showing the advantages of the LHT especially in images containing oriented textures.;4
Noise and Signal Estimation in Magnitude MRI and Rician Distributed Images: A LMMSE Approach;"filtering theory; image denoising; least mean squares methods; magnetic resonance imaging; statistical distributions; lmmse approach; rayleigh model; rician model; image noise filtering; linear minimum mean square error estimator; local sample statistical distribution; magnetic resonance imaging; magnitude mri; probability density function; linear minimum mean square error (lmmse) estimator; mri filtering; rician noise; noise estimation; algorithms; artifacts; brain; data interpretation, statistical; image enhancement; image interpretation, computer-assisted; least-squares analysis; magnetic resonance imaging; models, statistical; reproducibility of results; sensitivity and specificity;""";A new method for noise filtering in images that follow a Rician model-with particular attention to magnetic resonance imaging-is proposed. To that end, we have derived a (novel) closed-form solution of the linear minimum mean square error (LMMSE) estimator for this distribution. Additionally, a set of methods that automatically estimate the noise power are developed. These methods use information of the sample distribution of local statistics of the image, such as the local variance, the local mean, and the local mean square value. Accordingly, the dynamic estimation of noise leads to a recursive version of the LMMSE, which shows a good performance in both noise cleaning and feature preservation. This paper also includes the derivation of the probability density function of several local sample statistics for the Rayleigh and Rician model, upon which the estimators are built.;4
Noniterative Interpolation-Based Super-Resolution Minimizing Aliasing in the Reconstructed Image;"image reconstruction; image resolution; interpolation; iterative methods; mesh generation; splines (mathematics); b-splines; delaunay triangulation; image reconstruction; interpolation problem; inverse problem; iterative methods; low-resolution undersampled images; noniterative interpolation; point spread function; point spread function imaging system; sampling theory; super-resolution minimizing aliasing; data models; image reconstruction; image resolution; image restoration; image sampling; interpolation; sampling methods; signal resolution; spline; strontium; image reconstruction; inverse problem; nonuniform sampling; super-resolution; algorithms; artifacts; image enhancement; image interpretation, computer-assisted; reproducibility of results; sensitivity and specificity; subtraction technique;""";Super-resolution (SR) techniques produce a high-resolution image from a set of low-resolution undersampled images. In this paper, we propose a new method for super-resolution that uses sampling theory concepts to derive a noniterative SR algorithm. We first raise the issue of the validity of the data model usually assumed in SR, pointing out that it imposes a band-limited reconstructed image plus a certain type of noise. We propose a sampling theory framework with a prefiltering step that allows us to work with more general data models and also a specific new method for SR that uses Delaunay triangulation and B-splines to build the super-resolved image. The proposed method is noniterative and well posed. We prove its effectiveness against traditional iterative and noniterative SR methods on synthetic and real data. Additionally, we also prove that we can first solve the interpolation problem and then make the deblurring not only when the motion is translational but also when there are rotations and shifts and the imaging system point spread function (PSF) is rotationally symmetric.;4
Multiresolution Bilateral Filtering for Image Denoising;"channel bank filters; image denoising; image resolution; nonlinear filters; wavelet transforms; image denoising; multiresolution bilateral filtering; nonlinear filter; optimal bilateral filter parameter selection; wavelet filter bank; wavelet thresholding; colored noise; filter bank; filtering; image denoising; image resolution; least squares approximation; low-frequency noise; signal resolution; spatial resolution; temperature sensors; algorithms; artifacts; image enhancement; image interpretation, computer-assisted; imaging, three-dimensional; reproducibility of results; sensitivity and specificity; signal processing, computer-assisted;""";"The bilateral filter is a nonlinear filter that does spatial averaging without smoothing edges; it has shown to be an effective image denoising technique. An important issue with the application of the bilateral filter is the selection of the filter parameters, which affect the results significantly. There are two main contributions of this paper. The first contribution is an empirical study of the optimal bilateral filter parameter selection in image denoising applications. The second contribution is an extension of the bilateral filter: multiresolution bilateral filter, where bilateral filtering is applied to the approximation (low-frequency) subbands of a signal decomposed using a wavelet filter bank. The multiresolution bilateral filter is combined with wavelet thresholding to form a new image denoising framework, which turns out to be very effective in eliminating noise in real noisy images. Experimental results with both simulated and real data are provided.";4
Face recognition from a single image per person: A survey;"face recognition; single training image per person;";"One of the main challenges faced by the current face recognition techniques lies in the difficulties of collecting samples. Fewer samples per person mean less laborious effort for collecting them, lower cost for storing and processing them. Unfortunately, many reported face recognition techniques rely heavily on the size and representative of training set, and most of them will suffer serious performance drop or even fail to work if only one training sample per person is available to the systems. This situation is called &ldquo;one sample per person&rdquo; problem: given a stored database of faces, the goal is to identify a person from the database later in time in any different and unpredictable poses, lighting, etc. from just one image. Such a task is very challenging for most current algorithms due to the extremely limited representative of training sample. Numerous techniques have been developed to attack this problem, and the purpose of this paper is to categorize and evaluate these algorithms. The prominent algorithms are described and critically analyzed. Relevant issues such as data collection, the influence of the small sample size, and system evaluation are discussed, and several promising directions for future research are also proposed in this paper.";1
Techniques for the segmentation of striation patterns;"image segmentation; image texture; anisotropy analysis; forensic science; image processing techniques; striation patterns segmentation; anisotropic magnetoresistance; azimuth; forensics; image databases; image processing; image segmentation; light sources; lighting; qualifications; robustness; anisotropy analysis; forensic science; illumination series; image fusion; oriented patterns; striation patterns; algorithms; forensic sciences; image enhancement; image interpretation, computer-assisted; imaging, three-dimensional; information storage and retrieval; pattern recognition, automated;""";In this contribution, image processing techniques are investigated to robustly segment faint striation patterns from mainly isotropic background areas. Whereas well-known procedures to determine local anisotropy can be applied directly to single images, this paper describes an alternative strategy that uses an illumination series. The series is obtained with a spot illumination whose azimuth is varied systematically. The technique is based on the characteristics of the local contrast with respect to the azimuth of the illumination: Whereas pronounced maxima of the local contrast can be observed when the striae are illuminated perpendicularly, an isotropic background texture shows less distinct maxima for random azimuth angles. The qualification of the approach is demonstrated on the segmentation of faint tool marks in forensic science. Experimental results show that the methodology ensures the correct segmentation of such marks.;3
