title;keywords;annotation;class
Classification of image objects in Epo doping control using fuzzy decision tree;"epo doping control; fuzzy decision tree; image segmentation; machine learning classification;";"Erythropoietin (Epo) is a hormone which can be misused as a doping substance. Its detection involves analysis of images containing specific objects (bands), whose position and intensity are critical for doping positivity. Within a research project of the World Anti-Doping Agency (WADA) we are implementing the GASepo software that serves for Epo testing in doping control laboratories worldwide. For identification of the bands we have developed a segmentation procedure based on a sequence of filters. Whereas all true bands are properly segmented, the procedure generates a number of false positives (artefacts). To separate these artefacts we suggested a post-segmentation supervised classification using real-valued geometrical measures of objects. The method is based on a fuzzy modification of Ross Quinlan_s ID3 method, included in the mlf"" software (Machine Learning Framework). It provides a framework that generates fuzzy decision trees, as well as fuzzy sets for input data. Initially used training set of segmented objects has been replaced by a new one prepared by more accurate expertise using the latest release of the GASepo software. The new fuzzy decision trees (FDT) have been generated for a set of five and nine fuzzy sets. The comparison of the results on testing set of segmented objects shows that the classification based on the new FDTs outperforms other classification methods.";3
Localizing Region-Based Active Contours;"feature extraction; image segmentation; statistical analysis; global image statistics; heterogeneous feature profiles; image segmentation; objects segmentation; region-based active contours localization; standard global method; active contours; curve evolution; image segmentation; level set methods; multiregion segmentation; partial differential equations; algorithms; artificial intelligence; image enhancement; image interpretation, computer-assisted; pattern recognition, automated; reproducibility of results; sensitivity and specificity;""";In this paper, we propose a natural framework that allows any region-based segmentation energy to be re-formulated in a local way. We consider local rather than global image statistics and evolve a contour based on local information. Localized contours are capable of segmenting objects with heterogeneous feature profiles that would be difficult to capture correctly using a standard global method. The presented technique is versatile enough to be used with any global region-based active contour energy and instill in it the benefits of localization. We describe this framework and demonstrate the localization of three well-known energies in order to illustrate how our framework can be applied to any energy. We then compare each localized energy to its global counterpart to show the improvements that can be achieved. Next, an in-depth study of the behaviors of these energies in response to the degree of localization is given. Finally, we show results on challenging images to illustrate the robust and accurate segmentations that are possible with this new class of active contour models.;3
Monte-Carlo Sure: A Black-Box Optimization of Regularization Parameters for General Denoising Algorithms;"gaussian noise; monte carlo methods; image denoising; image restoration; mean square error methods; optimisation; risk analysis; monte-carlo sure; stein unbiased risk estimate; black-box optimization; corrupted signal restoration; image-denoising algorithm; mean-squared error; regularization parameter; signal denoising algorithm; white gaussian noise; bayesian methods; biomedical measurements; filtering algorithms; gaussian noise; image restoration; noise measurement; noise reduction; signal restoration; smoothing methods; wiener filter; monte-carlo methods; stein&#039;s unbiased risk estimate (sure); regularization parameter; smoothing splines; total-variation denoising; wavelet denoising; algorithms; artifacts; computer simulation; data interpretation, statistical; image enhancement; image interpretation, computer-assisted; models, statistical; monte carlo method; reproducibility of results; sensitivity and specificity;""";We consider the problem of optimizing the parameters of a given denoising algorithm for restoration of a signal corrupted by white Gaussian noise. To achieve this, we propose to minimize Steins unbiased risk estimate (SURE) which provides a means of assessing the true mean-squared error (MSE) purely from the measured data without need for any knowledge about the noise-free signal. Specifically, we present a novel Monte-Carlo technique which enables the user to calculate SURE for an arbitrary denoising algorithm characterized by some specific parameter setting. Our method is a black-box approach which solely uses the response of the denoising operator to additional input noise and does not ask for any information about its functional form. This, therefore, permits the use of SURE for optimization of a wide variety of denoising algorithms. We justify our claims by presenting experimental results for SURE-based optimization of a series of popular image-denoising algorithms such as total-variation denoising, wavelet soft-thresholding, and Wiener filtering/smoothing splines. In the process, we also compare the performance of these methods. We demonstrate numerically that SURE computed using the new approach accurately predicts the true MSE for all the considered algorithms. We also show that SURE uncovers the optimal values of the parameters in all cases.;4
Semidefinite spectral clustering;"clustering; convex optimization; multi-way graph equipartitioning; semidefinite programming; spectral clustering;";Multi-way partitioning of an undirected weighted graph where pairwise similarities are assigned as edge weights, provides an important tool for data clustering, but is an NP-hard problem. Spectral relaxation is a popular way of relaxation, leading to spectral clustering where the clustering is performed by the eigen-decomposition of the (normalized) graph Laplacian. On the other hand, semidefinite relaxation, is an alternative way of relaxing a combinatorial optimization, leading to a convex optimization. In this paper we employ a semidefinite programming (SDP) approach to the graph equipartitioning for clustering, where sufficient conditions for strong duality hold. The method is referred to as semidefinite spectral clustering, where the clustering is based on the eigen-decomposition of the optimal feasible matrix computed by SDP. Numerical experiments with several data sets, demonstrate the useful behavior of our semidefinite spectral clustering, compared to existing spectral clustering methods.;1
Improved quality of reconstructed images using floating point arithmetic for moment calculation;"geometric moments; zernike moments; pattern recognition; feature extraction; image reconstruction;";Zernike moments which are superior to geometric moments because of their special properties of image reconstruction and immunity to noise, suffer from several discretization errors. These errors lead to poor quality of reconstructed image and wide variations in the numerical values of the moments. The predominant factor, as observed in this paper, is due to the discrete integer implementation of the steps involved in moment calculation. It is shown in this paper that by modifying the algorithms to include discrete float implementation, the quality of the reconstructed image improves significantly and the first-order moment becomes zero. Low-order Zernike moments have been found to be stable under linear transformations while the high-order moments have large variations. The large variations in high-order moments, however, do not greatly affect the quality of the reconstructed image, implying that they should be ignored when numerical values of moments are used as features. The 11 functions based on geometric moments have also been found to be stable under linear transformations and thus these can be used as features. Pixel level analysis of the images has been carried out to strengthen the results.;1
A novel approach to the fast computation of Zernike moments;"zernike moments; fast method; symmetry/anti-symmetry; discrete zernike moments;";"This paper presents a novel approach to the fast computation of Zernike moments from a digital image. Most existing fast methods for computing Zernike moments have focused on the reduction of the computational complexity of the Zernike 1-D radial polynomials by introducing their recurrence relations. Instead, in our proposed method, we focus on the reduction of the complexity of the computation of the 2-D Zernike basis functions. As Zernike basis functions have specific symmetry or anti-symmetry about the x-axis, the y &#xA0;-axis, the origin, and the straight line y=xy=x, we can generate the Zernike basis functions by only computing one of their octants. As a result, the proposed method makes the computation time eight times faster than existing methods. The proposed method is applicable to the computation of an individual Zernike moment as well as a set of Zernike moments. In addition, when computing a series of Zernike moments, the proposed method can be used with one of the existing fast methods for computing Zernike radial polynomials. This paper also presents an accurate form of Zernike moments for a discrete image function. In the experiments, results show the accuracy of the form for computing discrete Zernike moments and confirm that the proposed method for the fast computation of Zernike moments is much more efficient than existing fast methods in most cases.";3
A fuzzy logic approach for detection of video shot boundaries;"temporal video segmentation; shot cut detection; shot-boundary detection; content-based video processing;";Video temporal segmentation is normally the first and important step for content-based video applications. Many features including the pixel difference, colour histogram, motion, and edge information etc. have been widely used and reported in the literature to detect shot cuts inside videos. Although existing research on shot cut detection is active and extensive, it still remains a challenge to achieve accurate detection of all types of shot boundaries with one single algorithm. In this paper, we propose a fuzzy logic approach to integrate hybrid features for detecting shot boundaries inside general videos. The fuzzy logic approach contains two processing modes, where one is dedicated to detection of abrupt shot cuts including those short dissolved shots, and the other for detection of gradual shot cuts. These two modes are unified by a mode-selector to decide which mode the scheme should work on in order to achieve the best possible detection performances. By using the publicly available test data set from Carleton University, extensive experiments were carried out and the test results illustrate that the proposed algorithm outperforms the representative existing algorithms in terms of the precision and recall rates.;3
Fuzzy Cognitive Maps for stereovision matching;"fuzzy cognitive maps; fuzzy clustering; relaxation; fuzzy; stereovision; matching; similarity; smoothness; ordering; epipolar; uniqueness;";This paper outlines a method for solving the stereovision matching problem using edge segments as the primitives. In stereovision matching the following constraints are commonly used: epipolar, similarity, smoothness, ordering and uniqueness. We propose a new matching strategy under a fuzzy context in which such constraints are mapped. The fuzzy context integrates both Fuzzy Clustering and Fuzzy Cognitive Maps. With such purpose a network of concepts (nodes) is designed, each concept represents a pair of primitives to be matched. Each concept has associated a fuzzy value which determines the degree of the correspondence. The goal is to achieve high performance in terms of correct matches. The main findings of this paper are reflected in the use of the fuzzy context that allows building the network of concepts where the matching constraints are mapped. Initially, each concept value is loaded via the Fuzzy Clustering and then updated by the Fuzzy Cognitive Maps framework. This updating is achieved through the influence of the remainder neighboring concepts until a good global matching solution is achieved. Under this fuzzy approach we gain quantitative and qualitative matching correspondences. This method works as a relaxation matching approach and its performance is illustrated by comparative analysis against some existing global matching methods.;1
A study of identical twins_ palmprints for personal verification;"identical twins; palmprint; biometric; personal identification;";Automatic biometric systems based on human characteristics for personal identification have attracted great attention. Their performance highly depends on the distinctive information in the biometrics. Identical twins having the closest genetics-based relationship are expected to have maximum similarity in their biometrics. Classifying identical twins is a challenging problem for some automatic biometric systems. Palmprint has been studied for personal identification for over seven years. Most of the previous research concentrates on algorithm development. In this paper, we systemically examine palmprints from the same DNA for automatic personal identification and to uncover the genetically related palmprint features. The experimental results show that the three principal lines and some portions of weak lines are genetically related features but our palms still contain rich genetically unrelated features for classifying identical twins.;3
Face recognition using common faces method;"face recognition; common vector approach; kernel method;";In this paper, we propose a face recognition method called the commonface by using the common vector approach. A face image is regarded as a summation of a common vector which represents the invariant properties of the corresponding face class, and a difference vector which presents the specific properties of the corresponding face image such as face appearance, pose and expression. Thus, by deriving the common vector of each face class, the common feature of each person is obtained which removes the differences of face images belonging to the same person. For test face image, the remaining vector with each face class is derived with the similar procedure to the common vector, which is then compared with the common vector of each face class to predict the class label of query face by finding the minimum distance between the remaining vector and the common vector. Furthermore, we extend the common vector approach (CVP) to kernel CVP to improve the performance of CVP. The experimental results suggest that the proposed commonface approach provides a better representation of individual common feature and achieves lower error rates in face recognition.;3
Fuzzy discriminant analysis with kernel methods;"fuzzy discriminant analysis; kernel methods; kernel fuzzy discriminant analysis;";A novel fuzzy nonlinear classifier, called kernel fuzzy discriminant analysis (KFDA), is proposed to deal with linear non-separable problem. With kernel methods KFDA can perform efficient classification in kernel feature space. Through some nonlinear mapping the input data can be mapped implicitly into a high-dimensional kernel feature space where nonlinear pattern now appears linear. Different from fuzzy discriminant analysis (FDA) which is based on Euclidean distance, KFDA uses kernel-induced distance. Theoretical analysis and experimental results show that the proposed classifier compares favorably with FDA.;1
